<?xml version="1.0" encoding="UTF-8"?>
<!--

    (c) 2003-2017 MuleSoft, Inc. This software is protected under international copyright law. All use of this software
    is subject to MuleSoft's Master Subscription Agreement (or other Terms of Service) separately entered into between
    you and MuleSoft. If such an agreement is not in place, you may not use the software.

-->
<pip pipCode="3C3" pipVersion="V01.01"
    xmlns:xsi="http://www.w3.org/2001/XMLSchema-instance"
    xsi:noNamespaceSchemaLocation="../schemas/pip-detail.xsd">
  <processCode>Notify of Invoice</processCode>
  <transactionCode>Notify of Invoice</transactionCode>
  <activityIdentifier>Notify of Invoice</activityIdentifier>
  <initiatorPartnerRole>Invoice Provider</initiatorPartnerRole>
  <initiatorServiceCode>Invoice Provider Service</initiatorServiceCode>
  <responderPartnerRole>Invoice Receiver</responderPartnerRole>
  <responderServiceCode>Invoice Receiver Service</responderServiceCode>
  <requireSync>false</requireSync>
  <requireAsync>true</requireAsync>
  <retryCount>3</retryCount>
  <initiatorAction>
    <actionCode>Invoice Notification Action</actionCode>
    <requireSignedAction>true</requireSignedAction>
    <requireSignedAcknowledge>true</requireSignedAcknowledge>
    <timeToAcknowledge>7200</timeToAcknowledge>
    <dtdName>3C3_MS_V01_01_InvoiceNotification.dtd</dtdName>
    <xsdName>3C3_MS_V01_01_InvoiceNotification.xsd</xsdName>
  </initiatorAction>
</pip>
