<?xml version="1.0" encoding="UTF-8"?>
<!--

    (c) 2003-2017 MuleSoft, Inc. This software is protected under international copyright law. All use of this software
    is subject to MuleSoft's Master Subscription Agreement (or other Terms of Service) separately entered into between
    you and MuleSoft. If such an agreement is not in place, you may not use the software.

-->
<pip pipCode="3A4" pipVersion="V02.02"
    xmlns:xsi="http://www.w3.org/2001/XMLSchema-instance"
    xsi:noNamespaceSchemaLocation="../schemas/pip-detail.xsd">
  <processCode>Request Purchase order</processCode>
  <transactionCode>Request Purchase Order</transactionCode>
  <activityIdentifier>Request Purchase Order</activityIdentifier>
  <initiatorPartnerRole>Buyer</initiatorPartnerRole>
  <initiatorServiceCode>Buyer Service</initiatorServiceCode>
  <responderPartnerRole>Seller</responderPartnerRole>
  <responderServiceCode>Seller Service</responderServiceCode>
  <requireSync>false</requireSync>
  <requireAsync>true</requireAsync>
  <retryCount>3</retryCount>
  <initiatorAction>
    <actionCode>Purchase Order Request Action</actionCode>
    <requireSignedAction>true</requireSignedAction>
    <requireSignedAcknowledge>true</requireSignedAcknowledge>
    <timeToAcknowledge>7200</timeToAcknowledge>
    <dtdName>3A4_MS_V02_02_PurchaseOrderRequest.dtd</dtdName>
    <xsdName>3A4_MS_V02_02_PurchaseOrderRequest.xsd</xsdName>
  </initiatorAction>
  <responderAction>
    <actionCode>Purchase Order Confirmation Action</actionCode>
    <requireSignedAction>true</requireSignedAction>
    <requireSignedAcknowledge>true</requireSignedAcknowledge>
    <timeToAcknowledge>7200</timeToAcknowledge>
    <dtdName>3A4_MS_V02_02_PurchaseOrderConfirmation.dtd</dtdName>
    <xsdName>3A4_MS_V02_02_PurchaseOrderConfirmation.xsd</xsdName>
  </responderAction>
</pip>
